paperId,url,title,abstract,venue,year,referenceCount,citationCount,authors
0165f6875cbe02342d634bae23170392eca9e05a,https://www.semanticscholar.org/paper/0165f6875cbe02342d634bae23170392eca9e05a,Multisurface Interaction in the WILD Room,"The WILD (wall-sized interaction with large datasets) room serves as a testbed for exploring the next generation of interactive systems by distributing interaction across diverse computing devices, enabling multiple users to easily and seamlessly create, share, and manipulate digital content. The featured Web extra is a video of Michel Beaudouin-Lafon and his colleagues demonstrating how the WILD (wall-sized interaction with large datasets) room lets users view, explore, manipulate large amounts of digital content.",Computer,2012,12,82,"[{'authorId': '1401678555', 'name': 'M. Beaudouin-Lafon'}, {'authorId': '47278074', 'name': 'Stéphane Huot'}, {'authorId': '1793712', 'name': 'Mathieu Nancel'}, {'authorId': '1732917', 'name': 'W. Mackay'}, {'authorId': '1728256', 'name': 'Emmanuel Pietriga'}, {'authorId': '2182932', 'name': 'Romain Primet'}, {'authorId': '144906824', 'name': 'Julie Wagner'}, {'authorId': '3342979', 'name': 'O. Chapuis'}, {'authorId': '1753624', 'name': 'Clément Pillias'}, {'authorId': '2152856', 'name': 'James R. Eagan'}, {'authorId': '2449366', 'name': 'Tony Gjerlufsen'}, {'authorId': '3027683', 'name': 'C. Klokmose'}]"
ebf8b1459b597371ae7b19a6cb235f138a52e3a1,https://www.semanticscholar.org/paper/ebf8b1459b597371ae7b19a6cb235f138a52e3a1,Using rhythmic patterns as an input method,"While interaction techniques that use the temporal dimension have been used for a long time, such as multiple clicks or spring-loaded widgets, more advanced uses of rhythmic patterns have received little attention in HCI. Using such temporal structures to convey information can be particularly useful in situations where the visual channel is overloaded or even not available. In this paper we introduce Rhythmic Interaction as the use of rhythms for input. We report the results of two experiments that show that (i) rhythmic patterns can be efficiently reproduced by novice users and recognized by computer algorithms, and (ii) rhythmic patterns can be memorized as efficiently as traditional shortcuts when associating them with visual commands. Overall, these results demonstrate the potential of Rhythmic Interaction and open the way to a richer repertoire of interaction techniques.",International Conference on Human Factors in Computing Systems,2012,39,48,"[{'authorId': '2587564', 'name': 'Emilien Ghomi'}, {'authorId': '2059160915', 'name': 'Guillaume Faure'}, {'authorId': '1809689', 'name': 'Stéphane Huot'}, {'authorId': '3342979', 'name': 'O. Chapuis'}, {'authorId': '1401678555', 'name': 'M. Beaudouin-Lafon'}]"
f358fc95d52d6b272d1f1caf2f190964afdaf3a1,https://www.semanticscholar.org/paper/f358fc95d52d6b272d1f1caf2f190964afdaf3a1,Evaluating the benefits of real-time feedback in mobile augmented reality with hand-held devices,"Augmented Reality (AR) has been proved useful to guide operational tasks in professional domains by reducing the shift of attention between instructions and physical objects. Modern smartphones make it possible to use such techniques in everyday tasks, but raise new challenges for the usability of AR in this context: small screen, occlusion, operation ""through a lens"". We address these problems by adding real-time feedback to the AR overlay. We conducted a controlled experiment comparing AR with and without feedback, and with standard textual and graphical instructions. Results show significant benefits for mobile AR with feedback and reveals some problems with the other techniques.",International Conference on Human Factors in Computing Systems,2012,8,51,"[{'authorId': '2116904856', 'name': 'Can Liu'}, {'authorId': '1809689', 'name': 'Stéphane Huot'}, {'authorId': '144466641', 'name': 'Jonathan Diehl'}, {'authorId': '1732917', 'name': 'W. Mackay'}, {'authorId': '1401678555', 'name': 'M. Beaudouin-Lafon'}]"
62831ed6656cf44784075dcda5b51ed134d42120,https://www.semanticscholar.org/paper/62831ed6656cf44784075dcda5b51ed134d42120,Precision Pointing for Ultra-High-Resolution Wall Displays,"Ultra-high-resolution wall displays have proven useful for displaying large quantities of information, but lack appropriate interaction techniques to manipulate the data efficiently. We explore the limits of existing modeless remote pointing techniques, originally designed for lower resolution displays, and show that they do not support high-precision pointing on such walls. We then consider techniques that combine a coarse positioning mode to approach the target's area with a precise pointing mode for acquiring the target. We compare both new and existing techniques through a controlled experiment, and find that techniques combining ray casting with relative positioning or angular movements enable the selection of targets as small as 4 millimeters while standing 2 meters away from the display.",,2011,37,16,"[{'authorId': '1793712', 'name': 'Mathieu Nancel'}, {'authorId': '1728256', 'name': 'Emmanuel Pietriga'}, {'authorId': '1401678555', 'name': 'M. Beaudouin-Lafon'}]"
7d0c8f916fad2c0c305e7876a2638485a1f6dac6,https://www.semanticscholar.org/paper/7d0c8f916fad2c0c305e7876a2638485a1f6dac6,Session details: Tangible,,Proceedings of the 24th annual ACM symposium on User interface software and technology,2011,0,0,"[{'authorId': '1401678555', 'name': 'M. Beaudouin-Lafon'}]"
92bcbc5ec95944d911a08f4b2aeec91271f7ef87,https://www.semanticscholar.org/paper/92bcbc5ec95944d911a08f4b2aeec91271f7ef87,Shared substance: developing flexible multi-surface applications,"This paper presents a novel middleware for developing flexible interactive multi-surface applications. Using a scenario-based approach, we identify the requirements for this type of applications. We then introduce Substance, a data-oriented framework that decouples functionality from data, and Shared Substance, a middleware implemented in Substance that provides powerful sharing abstractions. We describe our implementation of two applications with Shared Substance and discuss the insights gained from these experiments. Our finding is that the combination of a data-oriented programming model with middleware support for sharing data and functionality provides a flexible, robust solution with low viscosity at both design-time and run-time.",International Conference on Human Factors in Computing Systems,2011,39,78,"[{'authorId': '2449366', 'name': 'Tony Gjerlufsen'}, {'authorId': '3027683', 'name': 'C. Klokmose'}, {'authorId': '2152856', 'name': 'James R. Eagan'}, {'authorId': '1753624', 'name': 'Clément Pillias'}, {'authorId': '1401678555', 'name': 'M. Beaudouin-Lafon'}]"
c5f5e5f6906aa9ae527fc195f2179c52dc02a610,https://www.semanticscholar.org/paper/c5f5e5f6906aa9ae527fc195f2179c52dc02a610,"Lessons learned from the WILD room, a multisurface interactive environment","Creating the next generation of interactive systems requires experimental platforms that let us explore novel forms of interaction in real settings. This article describes WILD, a high-performance environment for exploring multi-surface interaction that includes an ultra-high resolution wall display, a multitouch table, a motion tracking system and various mobile devices. The article describes the integrative research approach of the project and the lessons learned with respect to hardware, participatory design, interaction techniques and software engineering.",Interaction Homme-Machine,2011,21,26,"[{'authorId': '1401678555', 'name': 'M. Beaudouin-Lafon'}]"
d2a1c7629849a9b1b29f5f7936b14cc2250e2b5d,https://www.semanticscholar.org/paper/d2a1c7629849a9b1b29f5f7936b14cc2250e2b5d,Cracking the cocoa nut: user interface programming at runtime,"This article introduces runtime toolkit overloading, a novel approach to help third-party developers modify the interaction and behavior of existing software applications without access to their underlying source code. We describe the abstractions provided by this approach as well as the mechanisms for implementing them in existing environments. We describe Scotty, a prototype implementation for Mac OS X Cocoa that enables developers to modify existing applications at runtime, and we demonstrate a collection of interaction and functional transformations on existing off-the-shelf applications. We show how Scotty helps a developer make sense of unfamiliar software, even without access to its source code. We further discuss what features of future environments would facilitate this kind of runtime software development.",ACM Symposium on User Interface Software and Technology,2011,26,54,"[{'authorId': '2152856', 'name': 'James R. Eagan'}, {'authorId': '1401678555', 'name': 'M. Beaudouin-Lafon'}, {'authorId': '1732917', 'name': 'W. Mackay'}]"
d876eb82737617626954e0f05c12e7166621d54a,https://www.semanticscholar.org/paper/d876eb82737617626954e0f05c12e7166621d54a,Interaction Is the Future of Computing,,,2011,12,1,"[{'authorId': '1401678555', 'name': 'M. Beaudouin-Lafon'}, {'authorId': '2103444', 'name': 'P. Wegner'}]"
003255b406cef36de58a41d69a226bf64664f526,https://www.semanticscholar.org/paper/003255b406cef36de58a41d69a226bf64664f526,"Author Manuscript, Published in ""international Conference on Human Factors in Computing Systems Touchstone: Exploratory Design of Experiments","Touchstone, an open-source experiment design platform, is designed to help establish a solid research foundation for HCI, especially in the area of novel interaction techniques, by providing a repository and a set of tools to design, run and analyze controlled experiments.. Touchstone includes a design platform for exploring alternative designs of controlled laboratory experiments, a run platform for running subjects and a limited analysis platform for advice and access to on-line statistics packages. Designed for HCI researchers and their students, the goal is to facilitate the process of replicating and extending experiments in the research literature as well as creating new ones. We tested Touchstone by designing two controlled experiments. One replicates and extends a previous study of multiscale pointing interaction techniques: OrthoZoom was fastest, followed by bi-manual Pan & Zoom; SDAZ and traditional Pan & Zoom were significantly slower. The other illustrates how to create a new experiment.",,2010,21,48,"[{'authorId': '1732917', 'name': 'W. Mackay'}, {'authorId': '1802574', 'name': 'Caroline Appert'}, {'authorId': '1401678555', 'name': 'M. Beaudouin-Lafon'}, {'authorId': '3342979', 'name': 'O. Chapuis'}, {'authorId': '3165307', 'name': 'Yangzhou Du'}, {'authorId': '144381703', 'name': 'Jean-Daniel Fekete'}, {'authorId': '1692155', 'name': 'Y. Guiard'}]"
5cde522eb71495f19378817d220995f0b4296918,https://www.semanticscholar.org/paper/5cde522eb71495f19378817d220995f0b4296918,Open access to scientific publications,"The good, the bad, and the ugly.",Communications of the ACM,2010,0,20,"[{'authorId': '1401678555', 'name': 'M. Beaudouin-Lafon'}]"
6ccdf82c0bf5e2bd7bce1736756033e8e7706098,https://www.semanticscholar.org/paper/6ccdf82c0bf5e2bd7bce1736756033e8e7706098,Session details: Pointing and selecting,,Proceedings of the SIGCHI Conference on Human Factors in Computing Systems,2010,0,0,"[{'authorId': '1401678555', 'name': 'M. Beaudouin-Lafon'}]"
a3ce6a0dcb9f8c8060933a3d639b2ab06948ea4d,https://www.semanticscholar.org/paper/a3ce6a0dcb9f8c8060933a3d639b2ab06948ea4d,Viewpoint Open Access to Scientific Publications,,,2010,0,0,"[{'authorId': '1401678555', 'name': 'M. Beaudouin-Lafon'}]"
128a1313331200244211d6b87c4aab076b565821,https://www.semanticscholar.org/paper/128a1313331200244211d6b87c4aab076b565821,Graphical Interaction,,Encyclopedia of Database Systems,2009,0,0,"[{'authorId': '1401678555', 'name': 'M. Beaudouin-Lafon'}]"
8cf6c8201c1d1a4c06ea5dcdf9d8ed2b3b77768a,https://www.semanticscholar.org/paper/8cf6c8201c1d1a4c06ea5dcdf9d8ed2b3b77768a,VIGO: instrumental interaction in multi-surface environments,"This paper addresses interaction in multi-surface environments and questions whether the current application-centric approaches to user interfaces are adequate in this context, and presents an alternative approach based on instrumental interaction. The paper presents the VIGO (Views, Instruments, Governors and Objects) architecture and describes a prototype implementation. It then illustrates how to apply VIGO to support distributed interaction. Finally, it demonstrates how a classical Ubicomp interaction technique, Pick-and-Drop, can be easily implemented using VIGO.",International Conference on Human Factors in Computing Systems,2009,31,53,"[{'authorId': '3027683', 'name': 'C. Klokmose'}, {'authorId': '1401678555', 'name': 'M. Beaudouin-Lafon'}]"
c9c941a7ae9b3a67460ee2f1b9af9acb974f5913,https://www.semanticscholar.org/paper/c9c941a7ae9b3a67460ee2f1b9af9acb974f5913,Acquisition of Animated and Pop-Up Targets,,IFIP TC13 International Conference on Human-Computer Interaction,2009,30,3,"[{'authorId': '2059160915', 'name': 'Guillaume Faure'}, {'authorId': '3342979', 'name': 'O. Chapuis'}, {'authorId': '1401678555', 'name': 'M. Beaudouin-Lafon'}]"
eaf1a6d3093d73c44c8b14de230530230d8aaa63,https://www.semanticscholar.org/paper/eaf1a6d3093d73c44c8b14de230530230d8aaa63,Extending Marking Menus With Integral Dimensions: Application to the Dartboard Menu,"Marking menus have many benefits, including fast selection time, low error rate and fast transition to expert mode, but these are mitigated by a practical limit of 8 items per menu. Adding hierarchical levels increases capacity, but at the expense of longer selection times and higher error rates. In this paper we introduce Extended Marking Menus, a variant of marking menus that increases their width without sacrificing performance. Extended marking menus organize the items in several rings or layers. Selection is achieved by simultaneous control of direction, as in traditional marking menus, and another dimension such as distance, speed or pressure. We examine the design space of these new menus and study the Distance Extended Marking Menu, or Dartboard Menu, in more detail. We report on two experiments, one to calibrate the sizes of the rings, the other showing that it performs faster than the Zone and Flower menus but is less accurate than the Zone menu.",,2009,16,6,"[{'authorId': '1793712', 'name': 'Mathieu Nancel'}, {'authorId': '1401678555', 'name': 'M. Beaudouin-Lafon'}]"
37458c38d81d453de0cbf48497ec41bd5cfc389c,https://www.semanticscholar.org/paper/37458c38d81d453de0cbf48497ec41bd5cfc389c,"Proceedings of the 21st Annual ACM Symposium on User Interface Software and Technology, Monterey, CA, USA, October 19-22, 2008","It is our great pleasure to welcome you to the 21st ACM Symposium on User Interface Software and Technology -- UIST'08. This year's symposium continues its tradition of being the premier forum for innovations in the software and technology of human-computer interfaces. UIST is an intimate, single-track conference designed to make it easy to exchange both research results and implementation experiences. 
 
Last year's symposium celebrated the first 20 years of UIST. This year's symposium looks forward to the next 20 years. What will our technology interfaces look like 20 years from now? This year's keynote speakers will help us address this question. Dan Olsen, the ""father of UIST"", will kick off the conference with his perspective on the next 20 years. On Wednesday, Cynthia Breazeal will give a perspective on human-robot interaction, an upcoming field that will become important as the number of robots interacting with humans increases over the next two decades. 
 
UIST'08 attracted 177 submissions (115 papers and 62 technotes) from all over the world. The program committee accepted 34 submissions (25 papers and 9 technotes) after a thorough review process: Each submission was assigned to two program committee members, a primary and a secondary. For each submission, the primary assigned at least two external reviewers and the secondary at least one. After the reviews were received, both program committee members wrote a meta-review for every submission. Authors were then given access to their reviews and metareviews and allowed to write a short rebuttal. The program committee then met face-to-face in San Francisco on 20-21 June 2008 to examine each submission and select the best ones. Submissions were finally accepted only after the authors provided a final version that took committee members' comments into account and was approved by at least one program committee member.",ACM Symposium on User Interface Software and Technology,2008,0,0,"[{'authorId': '2070002084', 'name': 'S. Cousins'}, {'authorId': '1401678555', 'name': 'M. Beaudouin-Lafon'}]"
6c7d80d15c25bcf7008f087727fdb23570743328,https://www.semanticscholar.org/paper/6c7d80d15c25bcf7008f087727fdb23570743328,SwingStates: adding state machines to Java and the Swing toolkit,"This article describes SwingStates, a Java toolkit designed to facilitate the development of graphical user interfaces and bring advanced interaction techniques to the Java platform. SwingStates is based on the use of finite‐state machines specified directly in Java to describe the behavior of interactive systems. State machines can be used to redefine the behavior of existing Swing widgets or, in combination with a new canvas widget that features a rich graphical model, to create brand new widgets. SwingStates also supports arbitrary input devices to implement novel interaction techniques based, for example, on bi‐manual or pressure‐sensitive input. We have used SwingStates in several Master's‐level classes over the past two years and have developed a benchmark approach to evaluate the toolkit in this context. The results demonstrate that SwingStates can be used by non‐expert developers with little training to successfully implement advanced interaction techniques. Copyright © 2007 John Wiley & Sons, Ltd.","Software, Practice & Experience",2008,61,63,"[{'authorId': '1802574', 'name': 'Caroline Appert'}, {'authorId': '1401678555', 'name': 'M. Beaudouin-Lafon'}]"
866d31d4c076411ac67e87494c2bc2d694aa3f7f,https://www.semanticscholar.org/paper/866d31d4c076411ac67e87494c2bc2d694aa3f7f,PushMenu: Extending Marking Menus for Pressure-Enabled Input Devices,"Several approaches have been proposed to increase the breadth of standard Marking Menus over the 8 item limit, most of which have focused on the use of the standard 2D input space (x-y). We present Push Menu, an extension of Marking Menu that takes advantage of pressure input as a third input dimension to increase menu breadth. We present the results of a preliminary experiment that validates our design and shows that Push Menu users who are neither familiar with pen-based interfaces nor continuous pressure control can handle up to 20 items reliably. We also discuss the implications of these results for using Push Menu in user in- terfaces and for improving its design.",,2008,10,6,"[{'authorId': '1809689', 'name': 'Stéphane Huot'}, {'authorId': '1793712', 'name': 'Mathieu Nancel'}, {'authorId': '1401678555', 'name': 'M. Beaudouin-Lafon'}]"
9f1b9805d5b7c3f75b2146b2bf7fae0e9db158dc,https://www.semanticscholar.org/paper/9f1b9805d5b7c3f75b2146b2bf7fae0e9db158dc,Evaluation of pointing performance on screen edges,"Pointing on screen edges is a frequent task in our everyday use of computers. Screen edges can help stop cursor movements, requiring less precise movements from the user. Thus, pointing at elements located on the edges should be faster than pointing in the central screen area. This article presents two experiments to better understand the foundations of ""edge pointing"". The first study assesses several factors both on completion time and on users' mouse movements. The results highlight some weaknesses in the current design of desktop environments (such as the cursor shape) and reveal that movement direction plays an important role in users' performance. The second study quantifies the gain of edge pointing by comparing it with other models such as regular pointing and crossing. The results not only show that the gain can be up to 44%, but also reveal that movement angle has an effect on performance for all tested models. This leads to a generalization of the 2D Index of Difficulty of Accot and Zhai that takes movement direction into account to predict pointing time using Fitts' law.",International Working Conference on Advanced Visual Interfaces,2008,21,45,"[{'authorId': '1802574', 'name': 'Caroline Appert'}, {'authorId': '3342979', 'name': 'O. Chapuis'}, {'authorId': '1401678555', 'name': 'M. Beaudouin-Lafon'}]"
1788f634342b129f0d0fe1c08317e7b06871af47,https://www.semanticscholar.org/paper/1788f634342b129f0d0fe1c08317e7b06871af47,"Co-designing Communication Technology with and for Families - Methods, Experience, Results and Impact",,Disappearing Computer,2007,16,15,"[{'authorId': '37292851', 'name': 'Sinna Lindquist'}, {'authorId': '143633214', 'name': 'B. Westerlund'}, {'authorId': '144216246', 'name': 'Y. Sundblad'}, {'authorId': '3002419', 'name': 'Helena Tobiasson'}, {'authorId': '1401678555', 'name': 'M. Beaudouin-Lafon'}, {'authorId': '1732917', 'name': 'W. Mackay'}]"
410abc0b662bf6a47687038c1e7b7b5f5116c6db,https://www.semanticscholar.org/paper/410abc0b662bf6a47687038c1e7b7b5f5116c6db,Pointing lenses: facilitating stylus input through visual-and motor-space magnification,"Using a stylus on a tablet computer to acquire small targets can be challenging. In this paper we present pointing lenses -- interaction techniques that help users acquire and select targets by presenting them with an enlarged visual and interaction area. We present and study three pointing lenses for pen-based systems and find that our proposed Pressure-Activated Lens is the top overall performer in terms of speed, accuracy and user preference. In addition, our experimental results not only show that participants find all pointing lenses beneficial for targets smaller than 5 pixels, but they also suggest that this benefit may extend to larger targets as well.",International Conference on Human Factors in Computing Systems,2007,19,70,"[{'authorId': '2057749310', 'name': 'Gonzalo A. Ramos'}, {'authorId': '1802643', 'name': 'A. Cockburn'}, {'authorId': '1748870', 'name': 'Ravin Balakrishnan'}, {'authorId': '1401678555', 'name': 'M. Beaudouin-Lafon'}]"
4297d383850a813d7f75a591ab378be85a520664,https://www.semanticscholar.org/paper/4297d383850a813d7f75a591ab378be85a520664,Pointing and beyond: an operationalization and preliminary evaluation of multi-scale searching,"A number of experimental studies based on domain-specific tasks have evaluated the efficiency of navigation techniques for searching multi-scale worlds. The discrepancies among their results call for a more generic framework similar in spirit to Fitts' reciprocal pointing task, but adapted to a task that significantly differs from pure pointing. We introduce such a framework based on an abstract task and evaluate how four multi-scale navigation techniques perform in one particular multi-scale world configuration. Experimental findings indicate that, in this context, pan & zoom combined with an overview is the most efficient technique of all four, and that focus + context techniques perform better than classical pan & zoom. We relate these findings to more realistic situations, discuss their applicability, and how the framework can be used to cover a broad range of situations.",International Conference on Human Factors in Computing Systems,2007,29,46,"[{'authorId': '1728256', 'name': 'Emmanuel Pietriga'}, {'authorId': '1802574', 'name': 'Caroline Appert'}, {'authorId': '1401678555', 'name': 'M. Beaudouin-Lafon'}]"
