paperId,url,title,abstract,venue,year,referenceCount,citationCount,authors
181acfb1b93c753af6107c55489e0a5c8b6d13cf,https://www.semanticscholar.org/paper/181acfb1b93c753af6107c55489e0a5c8b6d13cf,View size and pointing difficulty in multi-scale navigation,"Using a new taxonomy of pointing tasks which includes view pointing beside traditional cursor pointing, we introduce the concept of multi-scale pointing. Analyzing the impact of view size, we demonstrate theoretically and experimentally that (1) the time needed to reach a remotely located target in a multi-scale interface still obeys Fitts' law and (2) the bandwidth of the interaction (i.e., the inverse of Fitts' law slope) is proportional to view size, a relationship bounded by an early ceiling effect. We discuss these results with special reference to navigation in miniaturized and enlarged interfaces.",International Working Conference on Advanced Visual Interfaces,2004,24,48,"[{'authorId': '1692155', 'name': 'Y. Guiard'}, {'authorId': '1401678555', 'name': 'M. Beaudouin-Lafon'}, {'authorId': '39782775', 'name': 'J. Bastin'}, {'authorId': '2014699', 'name': 'D. Pasveer'}, {'authorId': '1748079', 'name': 'Shumin Zhai'}]"
1ff13a062967ad577ad5548499a1ddb8e3165b44,https://www.semanticscholar.org/paper/1ff13a062967ad577ad5548499a1ddb8e3165b44,Fitts' law 50 years later: applications and contributions from human-computer interaction,,Int. J. Hum. Comput. Stud.,2004,0,38,"[{'authorId': '1692155', 'name': 'Y. Guiard'}, {'authorId': '1401678555', 'name': 'M. Beaudouin-Lafon'}]"
409388ab6a828604784d1c14454dc9ad7a87ff9d,https://www.semanticscholar.org/paper/409388ab6a828604784d1c14454dc9ad7a87ff9d,"Designing interaction, not interfaces","Although the power of personal computers has increased 1000-fold over the past 20 years, user interfaces remain essentially the same. Innovations in HCI research, particularly novel interaction techniques, are rarely incorporated into products. In this paper I argue that the only way to significantly improve user interfaces is to shift the research focus from designing interfaces to designing interaction. This requires powerful interaction models, a better understanding of both the sensory-motor details of interaction and a broader view of interaction in the context of use. It also requires novel interaction architectures that address reinterpretability, resilience and scalability.",International Working Conference on Advanced Visual Interfaces,2004,46,369,"[{'authorId': '1401678555', 'name': 'M. Beaudouin-Lafon'}]"
6331351aa42eafc175f5df5ff4b96cbc50ffe7ab,https://www.semanticscholar.org/paper/6331351aa42eafc175f5df5ff4b96cbc50ffe7ab,Target acquisition in multiscale electronic worlds,,Int. J. Hum. Comput. Stud.,2004,39,86,"[{'authorId': '1692155', 'name': 'Y. Guiard'}, {'authorId': '1401678555', 'name': 'M. Beaudouin-Lafon'}]"
7b582ce13fbfdb85118abdb37bb2f3fa86f5a2cd,https://www.semanticscholar.org/paper/7b582ce13fbfdb85118abdb37bb2f3fa86f5a2cd,candidates for MEMBERS AT LARGE,,,2004,0,0,"[{'authorId': '1399251783', 'name': 'George Neville-Neil'}, {'authorId': '1401678555', 'name': 'M. Beaudouin-Lafon'}, {'authorId': '143786158', 'name': 'W. Hall'}, {'authorId': '9404966', 'name': 'B. Ryder'}, {'authorId': '2075761917', 'name': 'Kevin Schofield'}, {'authorId': '2116700146', 'name': 'John Morris'}, {'authorId': '2117182', 'name': 'David S. Wise'}]"
7f4aef64bf37bdd671032cb46a7fa825df1bcb6a,https://www.semanticscholar.org/paper/7f4aef64bf37bdd671032cb46a7fa825df1bcb6a,Preface: Fitts' law 50 years later: Applications and contributions from human-computer interaction,,,2004,14,41,"[{'authorId': '1692155', 'name': 'Y. Guiard'}, {'authorId': '1401678555', 'name': 'M. Beaudouin-Lafon'}]"
8b3d77c7468ff21b79bef8219cbfa26ba43dfe3b,https://www.semanticscholar.org/paper/8b3d77c7468ff21b79bef8219cbfa26ba43dfe3b,Object Pointing: A Complement to Bitmap Pointing in GUIs,"Pointing has been conceptualized and implemented so far as the act of selecting pixels in bitmap displays. We show that the current technique, which we call bitmap pointing (BMP), is often sub-optimal as it requires continuous information from the mouse while the system often just needs the discrete specification of objects. The paper introduces object pointing (OP), a novel interaction technique based on a special screen cursor that skips empty spaces, thus drastically reducing the waste of input information. We report data from 1D and 2D Fitts' law experiments showing that OP outperforms BMP and that the performance facilitation increases with the task's index of difficulty. We discuss the implementation of OP in current interfaces.",Graphics Interface,2004,17,163,"[{'authorId': '1692155', 'name': 'Y. Guiard'}, {'authorId': '2864180', 'name': 'R. Blanch'}, {'authorId': '1401678555', 'name': 'M. Beaudouin-Lafon'}]"
9536b738a3b02008665ba975564bfd4ec57246a1,https://www.semanticscholar.org/paper/9536b738a3b02008665ba975564bfd4ec57246a1,Context matters: Evaluating Interaction Techniques with the CIS Model,,British Computer Society Conference on Human-Computer Interaction,2004,20,49,"[{'authorId': '1802574', 'name': 'Caroline Appert'}, {'authorId': '1401678555', 'name': 'M. Beaudouin-Lafon'}, {'authorId': '1732917', 'name': 'W. Mackay'}]"
f86a29b66ab93bcf9e2e51718c47e738b719e095,https://www.semanticscholar.org/paper/f86a29b66ab93bcf9e2e51718c47e738b719e095,Semantic pointing: improving target acquisition with control-display ratio adaptation,"We introduce semantic pointing, a novel interaction technique that improves target acquisition in graphical user interfaces (GUIs). Semantic pointing uses two independent sizes for each potential target presented to the user: one size in motor space adapted to its importance for the manipulation, and one size in visual space adapted to the amount of information it conveys. This decoupling between visual and motor size is achieved by changing the control-to-display ratio according to cursor distance to nearby targets. We present a controlled experiment supporting our hypothesis that the performance of semantic pointing is given by Fitts' index of difficulty in motor rather than visual space. We apply semantic pointing to the redesign of traditional GUI widgets by taking advantage of the independent manipulation of motor and visual widget sizes.",International Conference on Human Factors in Computing Systems,2004,24,338,"[{'authorId': '2864180', 'name': 'R. Blanch'}, {'authorId': '1692155', 'name': 'Y. Guiard'}, {'authorId': '1401678555', 'name': 'M. Beaudouin-Lafon'}]"
4e63f7f9f5e987dfca29e18854f7cfb90f13637b,https://www.semanticscholar.org/paper/4e63f7f9f5e987dfca29e18854f7cfb90f13637b,Sharing daily-life images with videoProbe,"videoProbe is a device that takes pictures of everyday family life and shares them among multiple households. By providing family members with a new means of lightweight and informal communication, videoProbe allows unusual picture sharing and is likely to modify interactions within families. From a research perspective, videoProbe is an instance of a new class of device built to inspire ideas for the design of new communication technologies and to gather data about life in family.",Interaction Homme-Machine,2003,5,13,"[{'authorId': '1783132', 'name': 'Stéphane Conversy'}, {'authorId': '144784319', 'name': 'Nicolas Roussel'}, {'authorId': '2052583658', 'name': 'Heiko Hansen'}, {'authorId': '93506637', 'name': 'Helen Evans'}, {'authorId': '1401678555', 'name': 'M. Beaudouin-Lafon'}, {'authorId': '1732917', 'name': 'W. Mackay'}]"
4f185156374677a03df874d34bbb60bd72bbc6d0,https://www.semanticscholar.org/paper/4f185156374677a03df874d34bbb60bd72bbc6d0,Technology probes: inspiring design for and with families,"We describe a new method for use in the process of co-designing technologies with users called technology probes. Technology probes are simple, flexible, adaptable technologies with three interdisciplinary goals: the social science goal of understanding the needs and desires of users in a real-world setting, the engineering goal of field-testing the technology, and the design goal of inspiring users and researchers to think about new technologies. We present the results of designing and deploying two technology probes, the messageProbe and the videoProbe, with diverse families in France, Sweden, and the U.S. We conclude with our plans for creating new technologies for and with families based on our experiences.",International Conference on Human Factors in Computing Systems,2003,26,1427,"[{'authorId': '143624502', 'name': 'H. Hutchinson'}, {'authorId': '1732917', 'name': 'W. Mackay'}, {'authorId': '143633214', 'name': 'B. Westerlund'}, {'authorId': '1799187', 'name': 'B. Bederson'}, {'authorId': '145957514', 'name': 'A. Druin'}, {'authorId': '1764846', 'name': 'C. Plaisant'}, {'authorId': '1401678555', 'name': 'M. Beaudouin-Lafon'}, {'authorId': '1783132', 'name': 'Stéphane Conversy'}, {'authorId': '93506637', 'name': 'Helen Evans'}, {'authorId': '2052583658', 'name': 'Heiko Hansen'}, {'authorId': '144784319', 'name': 'Nicolas Roussel'}, {'authorId': '2496336', 'name': 'B. Eiderbäck'}]"
6af4c00830c79a3cbff3a951e74cadbeccbe2003,https://www.semanticscholar.org/paper/6af4c00830c79a3cbff3a951e74cadbeccbe2003,Human on-line response to target expansion,"McGuffin and Balakrishnan (M&B) have recently reported evidence that target expansion during a reaching movement reduces pointing time even if the expansion occurs as late as in the last 10% of the distance to be covered by the cursor. While M&B massed their static and expanding targets in separate blocks of trials, thus making expansion predictable for participants, we replicated their experiment with one new condition in which the target could unpredictably expand, shrink, or stay unchanged. Our results show that target expansion occurring as late as in M&B's experiment enhances pointing performance in the absence of expectation. We discuss these findings in terms of the basic human processes that underlie target-acquisition movements, and we address the implications for user interface design by introducing a revised design for the Mac OS X Dock.",International Conference on Human Factors in Computing Systems,2003,22,151,"[{'authorId': '1748079', 'name': 'Shumin Zhai'}, {'authorId': '1783132', 'name': 'Stéphane Conversy'}, {'authorId': '1401678555', 'name': 'M. Beaudouin-Lafon'}, {'authorId': '1692155', 'name': 'Y. Guiard'}]"
80b62bec3659781de913b947d984d24fc3678b3b,https://www.semanticscholar.org/paper/80b62bec3659781de913b947d984d24fc3678b3b,Contracts and Grants with Industry - French RNTL project INDIGO,,,2003,0,0,"[{'authorId': '1401678555', 'name': 'M. Beaudouin-Lafon'}, {'authorId': '2864180', 'name': 'R. Blanch'}, {'authorId': '1783132', 'name': 'Stéphane Conversy'}, {'authorId': '144381703', 'name': 'Jean-Daniel Fekete'}, {'authorId': '144784319', 'name': 'Nicolas Roussel'}]"
b8ee888448e5ce0813ac4fe18dd205b96af2acb7,https://www.semanticscholar.org/paper/b8ee888448e5ce0813ac4fe18dd205b96af2acb7,Contracts and Grants with Industry - European projects IST/FET InterLiving,,,2003,0,0,"[{'authorId': '1732917', 'name': 'W. Mackay'}, {'authorId': '1401678555', 'name': 'M. Beaudouin-Lafon'}, {'authorId': '1783132', 'name': 'Stéphane Conversy'}, {'authorId': '93506637', 'name': 'Helen Evans'}, {'authorId': '2052583658', 'name': 'Heiko Hansen'}, {'authorId': '144784319', 'name': 'Nicolas Roussel'}, {'authorId': '1399256463', 'name': 'Loïc Dachary'}, {'authorId': '3049585', 'name': 'Nicolas Gaudron'}]"
0362c817d2e4acec32f244d04fb8fc13dca4dcc3,https://www.semanticscholar.org/paper/0362c817d2e4acec32f244d04fb8fc13dca4dcc3,"Proceedings of the 14th French-speaking conference on Human-computer interaction, Conference Francophone sur l'Interaction Homme-Machine, IHM 2002, Poitiers, France, November 26-29, 2002",,Interaction Homme-Machine,2002,0,1,"[{'authorId': '32207198', 'name': 'P. Girard'}, {'authorId': '3020839', 'name': 'Thomas Baudel'}, {'authorId': '1401678555', 'name': 'M. Beaudouin-Lafon'}, {'authorId': '1794025', 'name': 'É. Lecolinet'}, {'authorId': '1697015', 'name': 'D. Scapin'}]"
0afab4249958d044861ebb26f6ede959e61b9529,https://www.semanticscholar.org/paper/0afab4249958d044861ebb26f6ede959e61b9529,Proceedings of the 30th Conference on l'Interaction Homme-Machine,L'Association Francophone d'Interaction Homme-Machine (AFIHM) est fiere d'apporter son soutien scientifique a l'organisation de la 23e conference IHM a Sophia-Antipolis.,Interaction Homme-Machine,2002,0,0,"[{'authorId': '32207198', 'name': 'P. Girard'}, {'authorId': '3020839', 'name': 'Thomas Baudel'}, {'authorId': '1401678555', 'name': 'M. Beaudouin-Lafon'}, {'authorId': '1794025', 'name': 'É. Lecolinet'}, {'authorId': '1697015', 'name': 'D. Scapin'}]"
4e8ce5996d8b3d22d521409cc55882f335afccd7,https://www.semanticscholar.org/paper/4e8ce5996d8b3d22d521409cc55882f335afccd7,"interLiving Deliverable 1.2 & 2.2, Co-design and New Technologies with Family Users",,,2002,32,3,"[{'authorId': '1401678555', 'name': 'M. Beaudouin-Lafon'}, {'authorId': '1799187', 'name': 'B. Bederson'}, {'authorId': '96362514', 'name': 'Stphane Conversy'}, {'authorId': '145957514', 'name': 'A. Druin'}, {'authorId': '69065302', 'name': 'Bjrn Eiderbck'}, {'authorId': '93506637', 'name': 'Helen Evans'}, {'authorId': '2052583658', 'name': 'Heiko Hansen'}, {'authorId': '1402054715', 'name': 'sa Harvard'}, {'authorId': '143624502', 'name': 'H. Hutchinson'}, {'authorId': '37292851', 'name': 'Sinna Lindquist'}, {'authorId': '1732917', 'name': 'W. Mackay'}, {'authorId': '1764846', 'name': 'C. Plaisant'}, {'authorId': '144784319', 'name': 'Nicolas Roussel'}, {'authorId': '144216246', 'name': 'Y. Sundblad'}, {'authorId': '143633214', 'name': 'B. Westerlund'}]"
562ed82c6de97c93b994df439cfdf1a7a7e77e41,https://www.semanticscholar.org/paper/562ed82c6de97c93b994df439cfdf1a7a7e77e41,Prototyping tools and techniques,"We begin with our definition of a prototype and then discuss prototypes as design artifacts, introducing four dimensions for analyzing them. We then discuss the role of prototyping within the design process, in particular the concept of a design space, and how it is expanded and contracted by generating and selecting design ideas. The next three sections describe specific prototyping approaches: Rapid prototyping, both off-line and on-line, for early stages of design, iterative prototyping, which uses on-line development tools, and evolutionary prototyping, which must be based on a sound software architecture.",,2002,67,254,"[{'authorId': '1401678555', 'name': 'M. Beaudouin-Lafon'}, {'authorId': '1732917', 'name': 'W. Mackay'}]"
944bc81f3c79af606a75b3867c7c1b2cf74432fc,https://www.semanticscholar.org/paper/944bc81f3c79af606a75b3867c7c1b2cf74432fc,Interactive multimedia user friendly video conference system having sound/vision collectors around horizontal circular screen with local/distant users interacting through screen,"Patent numbers: US7190388 (B2)US2004068736 (A1)FR2811501 (B1)EP1297699 (A1)FR2811501 (A1)WO0203692 (A1) Reference LEMA-PATENT-2008-001Search for this record at the European Patent Office Record created on 2008-03-26, modified on 2016-08-08",,2002,0,0,"[{'authorId': '1401678555', 'name': 'M. Beaudouin-Lafon'}, {'authorId': '144784319', 'name': 'Nicolas Roussel'}, {'authorId': '2110110976', 'name': 'Jacques Martin'}, {'authorId': '1686058', 'name': 'J. Gascuel'}, {'authorId': '66765762', 'name': 'G. Buchner'}, {'authorId': '2863827', 'name': 'Hervé Lissek'}]"
f95e1a99de397345a6c4943234fa5692e304e3b8,https://www.semanticscholar.org/paper/f95e1a99de397345a6c4943234fa5692e304e3b8,"Proceedings of the 15th Annual ACM Symposium on User Interface Software and Technology, Paris, France, October 27-30, 2002","UIST is the premier forum on innovative engineering of the human-computer interface. The symposium brings together user-interface researchers and practitioners with an interest in techniques, tools, and technology for constructing quality, innovative user interfaces. UIST grew out of a series of SIGGRAPH-supported workshops on User Interface Management Systems (UIMS).",ACM Symposium on User Interface Software and Technology,2002,0,0,"[{'authorId': '1401678555', 'name': 'M. Beaudouin-Lafon'}]"
071da244c15631156515e0e0528d744cc17f28ac,https://www.semanticscholar.org/paper/071da244c15631156515e0e0528d744cc17f28ac,CPN/tools: revisiting the desktop metaphor with post-WIMP interaction techniques,"CPN/Tools is an editor and simulator of Coloured Petri Nets that uses post-WIMP interaction techniques, including bi-manual interaction, toolglasses and marking menus and a new metaphor for managing the workspace. It challenges traditional ideas about user interfaces, getting rid of pull-down menus, scrollbars, and even selection, while providing the same or greater functionality than current GUIs. This demo presents the first version of CPN/Tools.",CHI Extended Abstracts,2001,6,8,"[{'authorId': '1401678555', 'name': 'M. Beaudouin-Lafon'}, {'authorId': '1732917', 'name': 'W. Mackay'}, {'authorId': '12798241', 'name': 'P. Andersen'}, {'authorId': '3178987', 'name': 'P. Janecek'}, {'authorId': '2594854', 'name': 'M. Jensen'}, {'authorId': '2553425', 'name': 'Henry Michael Lassen'}, {'authorId': '31207146', 'name': 'Kasper Lund'}, {'authorId': '49410864', 'name': 'K. Mortensen'}, {'authorId': '32308917', 'name': 'S. Munck'}, {'authorId': '2094931987', 'name': 'Katrine Ravn'}, {'authorId': '2892141', 'name': 'Anne V. Ratzer'}, {'authorId': '49750353', 'name': 'S. Christensen'}, {'authorId': '144351863', 'name': 'K. Jensen'}]"
51ef47f7695496643aae31dbee06f49ca30591ba,https://www.semanticscholar.org/paper/51ef47f7695496643aae31dbee06f49ca30591ba,Pan-zoom coordination in multi-scale pointing,"We report some data from an experiment on multi-scale pointing with right-hand panning and left-hand zooming. We use a new metric derived from Zhai and Milgram [6] to quantify pan-zoom coordination, and we show that two-handed input allows parallelism.",CHI Extended Abstracts,2001,7,19,"[{'authorId': '48276249', 'name': 'Frédéric Bourgeois'}, {'authorId': '1692155', 'name': 'Y. Guiard'}, {'authorId': '1401678555', 'name': 'M. Beaudouin-Lafon'}]"
667d01a19eacfd5dbe8414540400435839498014,https://www.semanticscholar.org/paper/667d01a19eacfd5dbe8414540400435839498014,CPN/Tools: A Post-WIMP Interface for Editing and Simulating Coloured Petri Nets,,ICATPN,2001,23,43,"[{'authorId': '1401678555', 'name': 'M. Beaudouin-Lafon'}, {'authorId': '1732917', 'name': 'W. Mackay'}, {'authorId': '12798241', 'name': 'P. Andersen'}, {'authorId': '3178987', 'name': 'P. Janecek'}, {'authorId': '2594854', 'name': 'M. Jensen'}, {'authorId': '2553425', 'name': 'Henry Michael Lassen'}, {'authorId': '31207146', 'name': 'Kasper Lund'}, {'authorId': '49410864', 'name': 'K. Mortensen'}, {'authorId': '32308917', 'name': 'S. Munck'}, {'authorId': '2892141', 'name': 'Anne V. Ratzer'}, {'authorId': '2094931987', 'name': 'Katrine Ravn'}, {'authorId': '49750353', 'name': 'S. Christensen'}, {'authorId': '144351863', 'name': 'K. Jensen'}]"
7da213ed3ec91984349581260e5d291b9b782996,https://www.semanticscholar.org/paper/7da213ed3ec91984349581260e5d291b9b782996,Beyond the 10-bit Barrier: Fitts' Law in Multi-Scale Electronic Worlds,,BCS HCI/IHM,2001,25,67,"[{'authorId': '1692155', 'name': 'Y. Guiard'}, {'authorId': '48276249', 'name': 'Frédéric Bourgeois'}, {'authorId': '1711426', 'name': 'Denis Mottet'}, {'authorId': '1401678555', 'name': 'M. Beaudouin-Lafon'}]"
9f1dd44907ecf5feaa2c0caa5eefcb09a6adbc45,https://www.semanticscholar.org/paper/9f1dd44907ecf5feaa2c0caa5eefcb09a6adbc45,Novel interaction techniques for overlapping windows,"This note presents several techniques to improve window management with overlapping windows: tabbed windows, turning and peeling back windows, and snapping and zipping windows.",ACM Symposium on User Interface Software and Technology,2001,7,102,"[{'authorId': '1401678555', 'name': 'M. Beaudouin-Lafon'}]"
a6dd1361664b7bb8692d17c4fda3c2b01c86051e,https://www.semanticscholar.org/paper/a6dd1361664b7bb8692d17c4fda3c2b01c86051e,Visualisation interactive d'information,"Information retrieval is no longer reserved to professional librarians. It has become a common activity for a large number of users. User interfaces to information retreival systems are often very primitive, consisting only of a text field to enter a query and a button to validate it. Many innovative visualisation and interaction techniques have been developed over the last ten years in order to address the challenge of making information retreival accessible to a wide variety of users and uses. Unfortunately these techniques are rarely used in actual systems. This articles summarizes the current state of the art in visualization and interaction that is relevant to the field of information retrieval.",,2001,61,33,"[{'authorId': '1813793', 'name': 'Mountaz Hascoët'}, {'authorId': '1401678555', 'name': 'M. Beaudouin-Lafon'}]"
b3b7aa363058e8c6de766c8c767045f88ccb564b,https://www.semanticscholar.org/paper/b3b7aa363058e8c6de766c8c767045f88ccb564b,CPN/Tools: A Tool for Editing and Simulating Coloured Petri Nets ETAPS Tool Demonstration Related to TACAS,,International Conference on Tools and Algorithms for Construction and Analysis of Systems,2001,6,29,"[{'authorId': '1401678555', 'name': 'M. Beaudouin-Lafon'}, {'authorId': '1732917', 'name': 'W. Mackay'}, {'authorId': '2594854', 'name': 'M. Jensen'}, {'authorId': '12798241', 'name': 'P. Andersen'}, {'authorId': '3178987', 'name': 'P. Janecek'}, {'authorId': '2553425', 'name': 'Henry Michael Lassen'}, {'authorId': '31207146', 'name': 'Kasper Lund'}, {'authorId': '49410864', 'name': 'K. Mortensen'}, {'authorId': '32308917', 'name': 'S. Munck'}, {'authorId': '2892141', 'name': 'Anne V. Ratzer'}, {'authorId': '2094931987', 'name': 'Katrine Ravn'}, {'authorId': '49750353', 'name': 'S. Christensen'}, {'authorId': '144351863', 'name': 'K. Jensen'}]"
e1a5dd09513ae0f29b583d7a57c8637fda38b2a0,https://www.semanticscholar.org/paper/e1a5dd09513ae0f29b583d7a57c8637fda38b2a0,DPI: A Conceptual Model Based on Documents and Interaction Instruments,,BCS HCI/IHM,2001,32,21,"[{'authorId': '3160992', 'name': 'Olivier Beaudoux'}, {'authorId': '1401678555', 'name': 'M. Beaudouin-Lafon'}]"
